{"boards":[{"board_id":"apple:j313","capabilities":[{"applicability":"unknown","capability_id":"audio","evidence_modality":"automated-and-human","threshold":2},{"applicability":"unknown","capability_id":"backlight","evidence_modality":"automated-and-human","threshold":2},{"applicability":"unknown","capability_id":"bluetooth","evidence_modality":"automated-and-human","threshold":2},{"applicability":"unknown","capability_id":"boot","evidence_modality":"automated-and-human","threshold":2},{"applicability":"unknown","capability_id":"camera","evidence_modality":"automated-and-human","threshold":2},{"applicability":"unknown","capability_id":"charging-battery","evidence_modality":"automated-and-human","threshold":2},{"applicability":"unknown","capability_id":"device-tree","evidence_modality":"automated-and-human","threshold":2},{"applicability":"unknown","capability_id":"ethernet","evidence_modality":"automated-and-human","threshold":2},{"applicability":"unknown","capability_id":"external-display","evidence_modality":"automated-and-human","threshold":2},{"applicability":"unknown","capability_id":"firmware","evidence_modality":"automated-and-human","threshold":2},{"applicability":"unknown","capability_id":"gpu","evidence_modality":"automated-and-human","threshold":2},{"applicability":"unknown","capability_id":"internal-display","evidence_modality":"automated-and-human","threshold":2},{"applicability":"unknown","capability_id":"kernel","evidence_modality":"automated-and-human","threshold":2},{"applicability":"unknown","capability_id":"keyboard","evidence_modality":"automated-and-human","threshold":2},{"applicability":"unknown","capability_id":"media","evidence_modality":"automated-and-human","threshold":2},{"applicability":"unknown","capability_id":"memory","evidence_modality":"automated-and-human","threshold":2},{"applicability":"unknown","capability_id":"nvme","evidence_modality":"automated-and-human","threshold":2},{"applicability":"unknown","capability_id":"recovery","evidence_modality":"automated-and-human","threshold":2},{"applicability":"unknown","capability_id":"sd","evidence_modality":"automated-and-human","threshold":2},{"applicability":"unknown","capability_id":"suspend-resume","evidence_modality":"automated-and-human","threshold":2},{"applicability":"unknown","capability_id":"thermal-fan","evidence_modality":"automated-and-human","threshold":2},{"applicability":"unknown","capability_id":"thunderbolt","evidence_modality":"automated-and-human","threshold":2},{"applicability":"unknown","capability_id":"touch-id-sep","evidence_modality":"automated-and-human","threshold":2},{"applicability":"unknown","capability_id":"trackpad","evidence_modality":"automated-and-human","threshold":2},{"applicability":"unknown","capability_id":"usb","evidence_modality":"automated-and-human","threshold":2},{"applicability":"unknown","capability_id":"virtualization","evidence_modality":"automated-and-human","threshold":2},{"applicability":"unknown","capability_id":"wifi","evidence_modality":"automated-and-human","threshold":2}],"profile_ids":["profile:j313-macbookair10-1"],"selector":"j313"}],"inventory_id":"omarchy-apple-silicon-qualification","revision":"2026-09-03.r1","schema":"qualification-board-inventory/v1","schema_set_digest":"sha256:8d00f2850396eba410b2745c568ffc1d9ec02fd1bb6c0250718f666ef7834c1f"}
